{
  "schema_version": "1.0.0",
  "run_id": "atelier-20260827t141000.000000000z-fedcba654321",
  "project_id": "project-0123456789abcdef0123456789abcdef",
  "project_revision": 0,
  "policy_mode": "standard",
  "engine": {
    "kind": "godot",
    "requested_version": "4.7.2-stable",
    "language": "gdscript"
  },
  "command": {
    "name": "build",
    "arguments": {
      "project": ".",
      "profile": "debug",
      "preset": "macOS Technical",
      "target": "macos-universal2",
      "timeout_ms": 180000,
      "engine_user_data": "standard-os-location",
      "godot_source": "explicit"
    }
  },
  "started_at": "2026-08-27T14:10:00Z",
  "producer": {
    "component": "gameatelier-cli",
    "version": "0.1.0"
  },
  "expected_result_ref": ".gameatelier/runs/atelier-20260827t141000.000000000z-fedcba654321/result.json",
  "declared_write_paths": [
    ".gameatelier/runs/atelier-20260827t141000.000000000z-fedcba654321",
    ".gameatelier/artifacts/atelier-20260827t141000.000000000z-fedcba654321"
  ],
  "declared_external_writes": [
    "godot:user-data:standard-os-location"
  ]
}
